{
  "$schema": "https://bfca.ca/schemas/material-v1.json",
  "schema_version": 1,
  "id": "lam011",

  "external_refs": {
    "beam_id": "LAM011",
    "beam_csv_row_index": 545,
    "mce2_id": null,
    "ec3_id": null,
    "ifc_material_guid": null
  },

  "naming": {
    "display_name": "Cross Laminated Timber (CLT) / Nordic / X-Lam / 3-1/2\"",
    "short_name": "CLT — Nordic X-Lam 3½\"",
    "material_name": "Cross Laminated Timber",
    "product_brand_name": "X-Lam"
  },

  "manufacturer": {
    "name": "Nordic",
    "country_code": "CAN",
    "specifications": "3-1/2\"",
    "website": null
  },

  "notes": null,
  "source_notes": "BfCA BioC calc by mass",

  "status": {
    "listed": true,
    "do_not_list": false,
    "is_industry_average": false,
    "is_beam_average": false,
    "visibility": "public"
  },

  "classification": {
    "group_prefix": "06",
    "category": "06_wood",
    "material_type": "Wood",
    "material_subtype": null,
    "product_type": "Structure",
    "product_subtype": "CLT",
    "typical_elements": ["floor", "roof_deck", "wall_shear", "structural_frame"]
  },

  "rendering": {
    "base_color": [0.82, 0.68, 0.44, 1.0],
    "metallic": 0.0,
    "roughness": 0.78,
    "texture": "textures/Wood/06-CLT-XLam.jpg",
    "has_grain": true
  },

  "physical": {
    "density": {
      "value_kg_m3": 456,
      "value_lb_ft3": 28.47,
      "source": "epd"
    },
    "thermal": {
      "conductivity_w_mk": null,
      "resistance_per_inch_rsi": null,
      "r_value_per_inch_imperial": null,
      "heat_capacity_j_kgk": null
    },
    "moisture_content_pct": null,
    "mass_per_unit_kg": null,
    "dimensions": {
      "length_m": null,
      "width_m": null,
      "depth_m": 0.0889,
      "unit_volume_m3": null,
      "units_per_m2": 11.249
    },
    "additional_factor": {
      "value": 0.09,
      "units": "m thickness",
      "description": "Nominal 3-1/2 inch thickness; used as divisor in m³→m² per-area conversion"
    }
  },

  "carbon": {
    "stated": {
      "value_kgco2e": 69.96,
      "per_unit": "m3",
      "source": "epd",
      "lifecycle_stages": ["A1", "A2", "A3"],
      "_lifecycle_scope_reference": {
        "_note": "Full EN 15804+A2 / ISO 21930 scope. LAM011 reports A1-A3 (cradle-to-gate). EU CPR/SPR-driven EPDs increasingly report A1-A5, C1-C4, and D. Schema supports all stages.",
        "product_stage":           { "A1": "raw material supply", "A2": "transport to manufacturer", "A3": "manufacturing" },
        "construction_stage":      { "A4": "transport to site",   "A5": "installation" },
        "use_stage_in_service":    { "B1": "use",                 "B2": "maintenance", "B3": "repair", "B4": "replacement", "B5": "refurbishment" },
        "use_stage_operational":   { "B6": "operational energy",  "B7": "operational water" },
        "end_of_life":             { "C1": "deconstruction",      "C2": "transport to disposal", "C3": "waste processing", "C4": "disposal" },
        "beyond_system_boundary":  { "D":  "reuse / recovery / recycling potential" }
      }
    },
    "conversion": {
      "to_common_unit": "m2 at 3.5\"",
      "factor": 0.088897,
      "factor_formula": "stated_per_m3 / units_per_m2",
      "factor_source": "physical_dimensions",
      "notes": "kgCO2e per m² at 3.5\" = kgCO2e per m³ ÷ 11.249 units/m² (1/0.0889)"
    },
    "common": {
      "value_kgco2e": 6.22,
      "per_functional_unit": "m2 at 3.5\"",
      "metric_unit_label": "m²",
      "imperial_unit_label": "ft²"
    },
    "biogenic": {
      "gwp_bio_from_epd_kgco2e_per_common_unit": null,
      "carbon_content_pct_kgc_kg": 0.5,
      "biogenic_factor": 0.9897,
      "storage_retention_pct": 0.9,
      "wwf_storage_factor_kgco2e_per_kgc": 67.08,
      "stored_kgco2e_per_common_unit": 67.08,
      "full_carbon_kgco2e_per_common_unit": 74.53,
      "carbon_content_kgc_per_unit": 20.31,
      "co2_to_c_molar_ratio": 3.67,
      "method": "wwf_storage_factor",
      "notes": "full_C = density × thickness × biogenic_factor × carbon_content × 3.67; stored = full_C × storage_retention"
    }
  },

  "impacts": {
    "functional_unit": "m2 at 3.5\"",
    "_structure_note": "Each category carries `total` (aggregate over stages declared in carbon.stated.lifecycle_stages) and `by_stage` (per-stage values from EPD tables). BEAM imports populate total only; EPD parser (Phase 2) fills by_stage. Every stage slot is schema-complete with {value, source} for audit parity.",
    "gwp_kgco2e": {
      "total": { "value": 6.22, "source": "beam_derived" },
      "by_stage": {
        "A1": { "value": null, "source": null },
        "A2": { "value": null, "source": null },
        "A3": { "value": null, "source": null },
        "A4": { "value": null, "source": null },
        "A5": { "value": null, "source": null },
        "B1": { "value": null, "source": null },
        "B2": { "value": null, "source": null },
        "B3": { "value": null, "source": null },
        "B4": { "value": null, "source": null },
        "B5": { "value": null, "source": null },
        "B6": { "value": null, "source": null },
        "B7": { "value": null, "source": null },
        "C1": { "value": null, "source": null },
        "C2": { "value": null, "source": null },
        "C3": { "value": null, "source": null },
        "C4": { "value": null, "source": null },
        "D":  { "value": null, "source": null }
      }
    },
    "gwp_bio_kgco2e": {
      "total": { "value": null, "source": null },
      "by_stage": {
        "A1": { "value": null, "source": null },
        "A2": { "value": null, "source": null },
        "A3": { "value": null, "source": null },
        "A4": { "value": null, "source": null },
        "A5": { "value": null, "source": null },
        "B1": { "value": null, "source": null },
        "B2": { "value": null, "source": null },
        "B3": { "value": null, "source": null },
        "B4": { "value": null, "source": null },
        "B5": { "value": null, "source": null },
        "B6": { "value": null, "source": null },
        "B7": { "value": null, "source": null },
        "C1": { "value": null, "source": null },
        "C2": { "value": null, "source": null },
        "C3": { "value": null, "source": null },
        "C4": { "value": null, "source": null },
        "D":  { "value": null, "source": null }
      }
    },
    "eutrophication_kgneq": {
      "total": { "value": null, "source": null },
      "by_stage": {
        "A1": { "value": null, "source": null },
        "A2": { "value": null, "source": null },
        "A3": { "value": null, "source": null },
        "A4": { "value": null, "source": null },
        "A5": { "value": null, "source": null },
        "B1": { "value": null, "source": null },
        "B2": { "value": null, "source": null },
        "B3": { "value": null, "source": null },
        "B4": { "value": null, "source": null },
        "B5": { "value": null, "source": null },
        "B6": { "value": null, "source": null },
        "B7": { "value": null, "source": null },
        "C1": { "value": null, "source": null },
        "C2": { "value": null, "source": null },
        "C3": { "value": null, "source": null },
        "C4": { "value": null, "source": null },
        "D":  { "value": null, "source": null }
      }
    },
    "acidification_kgso2eq": {
      "total": { "value": null, "source": null },
      "by_stage": {
        "A1": { "value": null, "source": null },
        "A2": { "value": null, "source": null },
        "A3": { "value": null, "source": null },
        "A4": { "value": null, "source": null },
        "A5": { "value": null, "source": null },
        "B1": { "value": null, "source": null },
        "B2": { "value": null, "source": null },
        "B3": { "value": null, "source": null },
        "B4": { "value": null, "source": null },
        "B5": { "value": null, "source": null },
        "B6": { "value": null, "source": null },
        "B7": { "value": null, "source": null },
        "C1": { "value": null, "source": null },
        "C2": { "value": null, "source": null },
        "C3": { "value": null, "source": null },
        "C4": { "value": null, "source": null },
        "D":  { "value": null, "source": null }
      }
    },
    "ozone_depletion_kgcfc11eq": {
      "total": { "value": null, "source": null },
      "by_stage": {
        "A1": { "value": null, "source": null },
        "A2": { "value": null, "source": null },
        "A3": { "value": null, "source": null },
        "A4": { "value": null, "source": null },
        "A5": { "value": null, "source": null },
        "B1": { "value": null, "source": null },
        "B2": { "value": null, "source": null },
        "B3": { "value": null, "source": null },
        "B4": { "value": null, "source": null },
        "B5": { "value": null, "source": null },
        "B6": { "value": null, "source": null },
        "B7": { "value": null, "source": null },
        "C1": { "value": null, "source": null },
        "C2": { "value": null, "source": null },
        "C3": { "value": null, "source": null },
        "C4": { "value": null, "source": null },
        "D":  { "value": null, "source": null }
      }
    },
    "smog_kgo3eq": {
      "total": { "value": null, "source": null },
      "by_stage": {
        "A1": { "value": null, "source": null },
        "A2": { "value": null, "source": null },
        "A3": { "value": null, "source": null },
        "A4": { "value": null, "source": null },
        "A5": { "value": null, "source": null },
        "B1": { "value": null, "source": null },
        "B2": { "value": null, "source": null },
        "B3": { "value": null, "source": null },
        "B4": { "value": null, "source": null },
        "B5": { "value": null, "source": null },
        "B6": { "value": null, "source": null },
        "B7": { "value": null, "source": null },
        "C1": { "value": null, "source": null },
        "C2": { "value": null, "source": null },